{
  "aspect_ratio": "16:9",
  "dialogue_must_be_verbatim": true,
  "director_grammar_path": "research/grammar/director_grammar_v0.2.json",
  "duration_tolerance_seconds": 0,
  "episode_id": "EP01",
  "execution_medium": "AI_PHOTOREAL_HUMAN",
  "generation_authorized": false,
  "project_id": "FORWARD-TEST-ORIGINAL-OBJECT-SECONDARY-HANDLING",
  "publication_authorized": false,
  "scenes": [
    {
      "allowed_characters": [
        "TECHNICIAN_A"
      ],
      "audience_information": {
        "locked_fact_ids": [
          "FACT-01",
          "FACT-02",
          "FACT-03"
        ]
      },
      "dramatic_engine": {
        "goal": "complete one written calibration check without over-covering secondary hand business",
        "objectives": [
          "record the reading"
        ],
        "obstacle": "the written value must remain readable",
        "stakes": "the record must match the instrument",
        "subtext": "none asserted",
        "tactic_change": "measurement becomes notation"
      },
      "duration_seconds": 15,
      "location": "plain project-original calibration desk",
      "narrative_goal": "complete one written calibration check without over-covering secondary hand business",
      "pov": {
        "character": "ENSEMBLE_NEUTRAL",
        "identification_level": "STRUCTURAL_TEST_ONLY"
      },
      "routing_input": {
        "case_id": "ORIGINAL-OBJECT-SECONDARY-HANDLING",
        "dramatic_structure": {
          "goal": "complete one written calibration check without over-covering secondary hand business",
          "objectives": [
            "record the reading"
          ],
          "obstacle": "the written value must remain readable",
          "stakes": "the record must match the instrument",
          "subtext": "none asserted",
          "tactic_change": "measurement becomes notation"
        },
        "locked_facts": [
          {
            "fact_id": "FACT-01",
            "fact_type": "object_identity",
            "source_ref": "locked-script.md#FACT-01",
            "status": "LOCKED",
            "value": "A pencil remains with Technician A throughout the written check."
          },
          {
            "fact_id": "FACT-02",
            "fact_type": "object_state_change",
            "source_ref": "locked-script.md#FACT-02",
            "status": "LOCKED",
            "value": "The pencil moves between two boxes but never changes owner, function, or required state."
          },
          {
            "fact_id": "FACT-03",
            "fact_type": "dependent_next_action",
            "source_ref": "locked-script.md#FACT-03",
            "status": "LOCKED",
            "value": "The next action depends only on the written reading, not on pencil custody."
          }
        ],
        "priority_constraints": [],
        "rights_boundary": {
          "contains_private_script": false,
          "contains_reference_surface": false,
          "project_original": true
        },
        "routing_signals": [
          "portable_object_state_change",
          "next_action_depends_on_object_state",
          "object_state_not_required"
        ],
        "scene_problem": {
          "primary": "PROCEDURAL_COMPETENCE",
          "secondary": [],
          "status": "LOCKED"
        },
        "schema_version": "director-routing-input/0.1",
        "subject_matter_tags": [
          "inspection"
        ],
        "unknown_fact_types": []
      },
      "routing_result": {
        "applied_constraint_ids": [
          "PC-DIALOGUE-TEXT-LOCK",
          "PC-LOCKED-STORY-AUTHORITY",
          "PC-MODEL-INDEPENDENT-IR",
          "PC-ORIGINAL-ASSETS",
          "PC-SOURCE-COVERAGE",
          "SC-AUTHORIZATION-GATES",
          "SC-HIGH-RISK-FALLBACK",
          "SC-HUMAN-REVIEW",
          "SC-NO-SUBJECT-SHORTCUT",
          "SC-NO-SURFACE-COPY",
          "SC-NO-UNKNOWN-PROMOTION"
        ],
        "case_id": "ORIGINAL-OBJECT-SECONDARY-HANDLING",
        "conflict_trace": [],
        "eligible_rule_ids": [
          "DR-AFTERMATH-BY-NEXT-ACTION",
          "DR-CONSEQUENTIAL-ACTION-VISIBLE-STATE-CHAIN",
          "DR-MOBILE-ATTENTION-HANDOFF",
          "DR-PERFORMANCE-OWNER-HOLD",
          "DR-RELATION-RESET-AFTER-SPATIAL-CHANGE",
          "DR-SHARED-FRAME-FOR-RELATION-ENDPOINT",
          "DR-STABLE-AXIS-STATE-LED-HOLDS"
        ],
        "human_review_status": "HUMAN_REVIEW_PENDING",
        "ir_handoff": "CONTINUE_WITH_PROJECT_CONSTRAINTS_ONLY",
        "rejected_rules": [
          {
            "blocking_fact_ids": [],
            "conflicting_rule_ids": [],
            "matched_not_applicable_signal_ids": [],
            "missing_fact_types": [
              "next_action_states",
              "visible_result"
            ],
            "rejection_reason_codes": [
              "REQUIRED_FACT_MISSING",
              "SCENE_PROBLEM_MISMATCH",
              "TRIGGER_NOT_MET"
            ],
            "rule_id": "DR-AFTERMATH-BY-NEXT-ACTION"
          },
          {
            "blocking_fact_ids": [],
            "conflicting_rule_ids": [],
            "matched_not_applicable_signal_ids": [],
            "missing_fact_types": [
              "cause_effect_chain",
              "one_to_many_response",
              "safe_resolution"
            ],
            "rejection_reason_codes": [
              "REQUIRED_FACT_MISSING",
              "SCENE_PROBLEM_MISMATCH",
              "TRIGGER_NOT_MET"
            ],
            "rule_id": "DR-CONSEQUENTIAL-ACTION-VISIBLE-STATE-CHAIN"
          },
          {
            "blocking_fact_ids": [],
            "conflicting_rule_ids": [],
            "matched_not_applicable_signal_ids": [],
            "missing_fact_types": [
              "connected_geography",
              "current_attention_state",
              "next_attention_owner"
            ],
            "rejection_reason_codes": [
              "REQUIRED_FACT_MISSING",
              "SCENE_PROBLEM_MISMATCH",
              "TRIGGER_NOT_MET"
            ],
            "rule_id": "DR-MOBILE-ATTENTION-HANDOFF"
          },
          {
            "blocking_fact_ids": [],
            "conflicting_rule_ids": [],
            "matched_not_applicable_signal_ids": [],
            "missing_fact_types": [
              "performance_progression"
            ],
            "rejection_reason_codes": [
              "REQUIRED_FACT_MISSING",
              "SCENE_PROBLEM_MISMATCH",
              "TRIGGER_NOT_MET"
            ],
            "rule_id": "DR-PERFORMANCE-OWNER-HOLD"
          },
          {
            "blocking_fact_ids": [],
            "conflicting_rule_ids": [],
            "matched_not_applicable_signal_ids": [],
            "missing_fact_types": [
              "counterpart_relation",
              "spatial_change"
            ],
            "rejection_reason_codes": [
              "REQUIRED_FACT_MISSING",
              "SCENE_PROBLEM_MISMATCH",
              "TRIGGER_NOT_MET"
            ],
            "rule_id": "DR-RELATION-RESET-AFTER-SPATIAL-CHANGE"
          },
          {
            "blocking_fact_ids": [],
            "conflicting_rule_ids": [],
            "matched_not_applicable_signal_ids": [],
            "missing_fact_types": [
              "distance_change",
              "relation_endpoint",
              "time_structure"
            ],
            "rejection_reason_codes": [
              "REQUIRED_FACT_MISSING",
              "SCENE_PROBLEM_MISMATCH",
              "TRIGGER_NOT_MET"
            ],
            "rule_id": "DR-SHARED-FRAME-FOR-RELATION-ENDPOINT"
          },
          {
            "blocking_fact_ids": [],
            "conflicting_rule_ids": [],
            "matched_not_applicable_signal_ids": [],
            "missing_fact_types": [
              "stable_axis",
              "visible_state_progression"
            ],
            "rejection_reason_codes": [
              "REQUIRED_FACT_MISSING",
              "SCENE_PROBLEM_MISMATCH",
              "TRIGGER_NOT_MET"
            ],
            "rule_id": "DR-STABLE-AXIS-STATE-LED-HOLDS"
          }
        ],
        "rights_boundary": {
          "subject_matter_used_for_selection": false,
          "surface_copy_allowed": false
        },
        "scene_problem": "PROCEDURAL_COMPETENCE",
        "schema_version": "director-routing-result/0.1",
        "selected_rules": [],
        "selection_count": 0,
        "status": "NO_APPLICABLE_RULE"
      },
      "scene_id": "EP01-SC01",
      "shots": [
        {
          "ai_complexity": {
            "camera": "LOW",
            "continuity": "MEDIUM",
            "performance": "LOW",
            "reasons": [
              "The test uses one readable state change per shot."
            ]
          },
          "allowed_characters": [
            "TECHNICIAN_A"
          ],
          "audio": {
            "instruction": null,
            "source_refs": [],
            "status": "PROJECT_ORIGINAL_ONLY"
          },
          "blocking": "Technician A writes two readings in one stable desk view.",
          "camera_angle": "eye level",
          "camera_end": "stable view after the listed beat",
          "camera_motion": {
            "mode": "LOCKED",
            "reason": "Preserve the locked state change without adding style claims."
          },
          "camera_path": {
            "direction": "NONE",
            "distance": "NONE",
            "mode": "LOCKED",
            "speed": "NONE",
            "stability": "LOCKED",
            "trigger": "FACT-01"
          },
          "camera_start": "stable view before the listed beat",
          "confidence": "UNKNOWN",
          "constraints": {
            "changes_here": [
              "FACT-01"
            ],
            "must_hold": [
              "A pencil remains with Technician A throughout the written check."
            ],
            "must_not_appear": [
              "research-work surface elements"
            ]
          },